{
  "schema_version": 1,
  "export_id": "88888888-8888-4888-8888-888888888888",
  "owner_id": "33333333-3333-4333-8333-333333333333",
  "created_at": "2026-09-10T00:00:00Z",
  "bundle_id": "bundle-ops-1",
  "files": [{"path": "observations/software-1.json", "size": 12, "sha256": "aaaaaaaaaaaaaaaaaaaaaaaaaaaaaaaaaaaaaaaaaaaaaaaaaaaaaaaaaaaaaaaa"}],
  "excluded_categories": ["credentials", "private", "approvals"],
  "observation_times": [{"kind": "software", "observed_at": "2026-09-10T00:00:00Z"}],
  "required_identity_refs": ["ops-call"]
}
